{"continuityGroupReferences":[],"dialogueCaptionReferences":[],"editionId":"lemonpress:manga-press-synthetic-001:manga-001","geometry":{"bleed":{"bottom":3000,"left":3000,"right":3000,"top":3000},"page":{"height":186000,"width":126000,"x":0,"y":0},"safeArea":{"height":170000,"width":110000,"x":8000,"y":8000},"trim":{"height":180000,"width":120000,"x":3000,"y":3000},"unit":"um"},"grants":{"derivativeReuse":true,"motionAdaptation":true,"pixelHarvest":false,"pixelReuse":true,"publicationReuse":false,"synthesizedSound":false},"internalSemantics":"unknown","issueId":"lemonpress:manga-press-synthetic-001:issue-001","kind":"content","logicalPageNumber":1,"narrativeReferences":[],"pageHash":"34c993228f0ee56c953f53d4882112ce5e77877a42b0c9928cdde5a599860111","pageId":"page-03","panelMap":null,"physicalSheetRelation":null,"rightsSource":{"path":"works/manga-press-specimen/admission-001.json","sha256":"480d1565fe4424a6dcd8c78f2a87ef98b2ad36bb2fdd252ad999faac8deae2c5"},"schema":"lemonpress/manga-page/v0","sourceImage":{"path":"works/manga-press-specimen/manga/001/pixels/page-03.png","sha256":"31065a32f761a0890d6046233f41609575cdf2f40e5788fe85a8697ec89e520c"},"sourceLineage":[{"path":"works/manga-press-specimen/source-001.json","sha256":"498f26aa8da6c7a1269f11a8836eb77e4c1e1f7ba1597a19935ddb919a95f595"}]}